{
  "$schema": "https://json-schema.org/draft/2019-09/schema",
  "$id": "http://example.com/example.json",
  "title": "Root Schema",
  "type": "object",
  "default": {},
  "required": [
    "recipeId",
    "userId",
    "photo",
    "title",
    "shortDesc",
    "serving",
    "difficulty",
    "time",
    "ingredients",
    "description"
  ],
  "properties": {
    "recipeId": {
      "title": "The recipeId Schema",
      "type": "string",
      "default": "",
      "examples": ["scb0001"]
    },
    "userId": {
      "title": "The userId Schema",
      "type": "string",
      "default": "",
      "examples": ["user0001"]
    },
    "photo": {
      "title": "The photo Schema",
      "type": "string",
      "default": "",
      "examples": ["url"]
    },
    "title": {
      "title": "The title Schema",
      "type": "string",
      "default": "",
      "examples": ["Easy chocolate fudge cake"]
    },
    "shortDesc": {
      "title": "The shortDesc Schema",
      "type": "string",
      "default": "",
      "examples": [
        "Need a guaranteed crowd-pleasing cake that's easy to make? This super-squidgy chocolate fudge cake with smooth icing is an instant baking win"
      ]
    },
    "serving": {
      "title": "The serving Schema",
      "type": "integer",
      "default": 0,
      "examples": [8]
    },
    "difficulty": {
      "title": "The difficulty Schema",
      "type": "integer",
      "default": 0,
      "examples": [0]
    },
    "time": {
      "title": "The time Schema",
      "type": "integer",
      "default": 0,
      "examples": [45]
    },
    "ingredients": {
      "title": "The ingredients Schema",
      "type": "array",
      "default": [],
      "items": {
        "title": "A Schema",
        "type": "object",
        "required": ["groupName", "list"],
        "properties": {
          "groupName": {
            "title": "The groupName Schema",
            "type": "string",
            "examples": ["default", "icing"]
          },
          "list": {
            "title": "The list Schema",
            "type": "array",
            "items": {
              "title": "A Schema",
              "type": "string",
              "examples": [
                "150ml sunflower oil, plus extra for the tin",
                "175g self-raising flour",
                "2 tbsp cocoa powder",
                "1 tsp bicarbonate of soda",
                "150g caster sugar",
                "2 tbsp golden syrup",
                "2 large eggs, lightly beaten",
                "150ml semi-skimmed milk",
                "100g unsalted butter",
                "225g icing sugar",
                "40g cocoa powder",
                "2Â½ tbsp milk (a little more if needed)"
              ]
            },
            "examples": []
          }
        },
        "examples": []
      },
      "examples": []
    },
    "description": {
      "title": "The description Schema",
      "type": "object",
      "default": {},
      "required": ["html", "json"],
      "properties": {
        "html": {
          "title": "The html Schema",
          "type": "string",
          "default": "",
          "examples": [
            "<h3><strong>Method</strong></h3><ul><li><p><strong>STEP 1</strong></p><p>Heat the oven to 180C/160C fan/gas 4. Oil and line the base of two 18cm sandwich tins. Sieve the flour, cocoa powder and bicarbonate of soda into a bowl. Add the caster sugar and mix well.</p></li><li><p><strong>STEP 2</strong></p><p>Make a well in the centre and add the golden syrup, eggs, sunflower oil and milk. Beat well with an electric whisk until smooth.</p></li><li><p><strong>STEP 3</strong></p><p>Pour the mixture into the two tins and bake for 25-30 mins until risen and firm to the touch. Remove from oven, leave to cool for 10 mins before turning out onto a cooling rack.</p></li><li><p><strong>STEP 4</strong></p><p>To make the icing, beat the unsalted butter in a bowl until soft. Gradually sieve and beat in the icing sugar and cocoa powder, then add enough of the milk to make the icing fluffy and spreadable.</p></li><li><p><strong>STEP 5</strong></p><p>Sandwich the two cakes together with the butter icing and cover the sides and the top of the cake with more icing.</p></li></ul>"
          ]
        },
        "json": {
          "title": "The json Schema",
          "type": "object",
          "default": {},
          "required": [],
          "properties": {},
          "examples": []
        }
      },
      "examples": []
    }
  },
  "examples": []
}
